movieimg/_alt,director,rating/duration/genre/releasedate,runtime,writers,stars,title,movieimg/_title,productioncompany,movieimg,genres,desc,pageUrl
Network Poster,Director: Sidney Lumet,R | 2h 1min | Drama | 27 November 1976 (USA),121 min,Writer: Paddy Chayefsky,"Stars: Faye Dunaway, William Holden, Peter Finch | See full cast & crew »",Network (1976),Network Poster,Runtime: 121 min,"http://ia.media-imdb.com/images/M/MV5BNzk5MjcxNTg2MF5BMl5BanBnXkFtZTgwMzY2MTUxMDE@._V1_UY268_CR9,0,182,268_AL_.jpg",Genres: Drama,"In the 1970s, terrorist violence is the stuff of networks' nightly news programming and the corporate structure of the UBS Television Network is changing. Meanwhile, Howard Beale, the aging UBS news anchor, has lost his once strong ratings share and so the network fires him. Beale reacts in an unexpected way. We then see how this affects the fortunes of Beale, his coworkers (Max Schumacher and Diana Christensen), and the network. Written by Bruce Janson <bruce@cs.su.oz.au>",http://www.imdb.com/title/tt0074958/?pf_rd_m=A2FGELUUNOQJNL&pf_rd_p=2398042102&pf_rd_r=1X7MCR93P67MJYT56GA5&pf_rd_s=center-1&pf_rd_t=15506&pf_rd_i=top&ref_=chttp_tt_180
Butch Cassidy and the Sundance Kid Poster,Director: George Roy Hill,"M | 1h 50min | Biography, Crime, Drama | 24 October 1969 (USA)",110 min,Writer: William Goldman,"Stars: Paul Newman, Robert Redford, Katharine Ross | See full cast & crew »",Butch Cassidy and the Sundance Kid (1969),Butch Cassidy and the Sundance Kid Poster,Show detailed company contact information on IMDbPro »,"http://ia.media-imdb.com/images/M/MV5BMTkyMTM2NDk5Nl5BMl5BanBnXkFtZTgwNzY1NzEyMDE@._V1_UX182_CR0,0,182,268_AL_.jpg",Genres: Biography | Crime | Drama | Western,"Butch and Sundance are the two leaders of the Hole-in-the-Wall Gang. Butch is all ideas, Sundance is all action and skill. The west is becoming civilized and when Butch and Sundance rob a train once too often, a special posse begins trailing them no matter where they run. Over rock, through towns, across rivers, the group is always just behind them. When they finally escape through sheer luck, Butch has another idea, ""Let's go to Bolivia"". Based on the exploits of the historical characters. Written by John Vogel <jlvogel@comcast.net>",http://www.imdb.com/title/tt0064115/?pf_rd_m=A2FGELUUNOQJNL&pf_rd_p=2398042102&pf_rd_r=1X7MCR93P67MJYT56GA5&pf_rd_s=center-1&pf_rd_t=15506&pf_rd_i=top&ref_=chttp_tt_181
The 400 Blows Poster,Director: François Truffaut,"Not Rated | 1h 39min | Crime, Drama | 16 November 1959 (USA)",99 min,"Writers: François Truffaut (scenario), Marcel Moussy (adaptation) (as M. Moussy) | 2 more credits »","Stars: Jean-Pierre Léaud, Albert Rémy, Claire Maurier | See full cast & crew »",The 400 Blows (1959),The 400 Blows Poster,Sound Mix: Mono,"http://ia.media-imdb.com/images/M/MV5BMTQzNTMzOTA2Ml5BMl5BanBnXkFtZTgwNDQ2OTI3MjE@._V1_UY268_CR0,0,182,268_AL_.jpg",Genres: Crime | Drama,"Seemingly in constant trouble at school, 14 year-old Antoine Doinel returns at the end of every day to a drab and unhappy home life. His parents have little money and he sleeps on a couch that's been pushed into the kitchen. He knows his mother is having an affair and his parents bicker constantly. He decides to skip school and begins a downward spiral of lies and later stealing. His parents are at their wits end and after he's stopped by the police, they decide the best thing to do would be to let Antoine face the consequences. He's sent to a juvenile detention facility where he doesn't do much better. He does manage to escape however......... Written by garykmcd",http://www.imdb.com/title/tt0053198/?pf_rd_m=A2FGELUUNOQJNL&pf_rd_p=2398042102&pf_rd_r=1X7MCR93P67MJYT56GA5&pf_rd_s=center-1&pf_rd_t=15506&pf_rd_i=top&ref_=chttp_tt_182
Stand by Me Poster,Director: Rob Reiner,"R | 1h 29min | Adventure, Drama | 22 August 1986 (USA)",89 min,"Writers: Stephen King (novel), Raynold Gideon (screenplay) | 1 more credit »","Stars: Wil Wheaton, River Phoenix, Corey Feldman | See full cast & crew »",Stand by Me (1986),Stand by Me Poster,"Production Co: Columbia Pictures Corporation, Act III, Act III Communications See more »","http://ia.media-imdb.com/images/M/MV5BNDk2MTkyMTA1OF5BMl5BanBnXkFtZTcwOTc2Njk3OA@@._V1_UX182_CR0,0,182,268_AL_.jpg",Genres: Adventure | Drama,"It's the summer of 1959 in Castlerock, Oregon and four 12 year-old boys - Gordie, Chris, Teddy and Vern - are fast friends. After learning of the general location of the body of a local boy who has been missing for several days, they set off into woods to see it. Along the way, they learn about themselves, the meaning of friendship and the need to stand up for what is right. Written by garykmcd",http://www.imdb.com/title/tt0092005/?pf_rd_m=A2FGELUUNOQJNL&pf_rd_p=2398042102&pf_rd_r=1X7MCR93P67MJYT56GA5&pf_rd_s=center-1&pf_rd_t=15506&pf_rd_i=top&ref_=chttp_tt_183
Persona Poster,Director: Ingmar Bergman,"Not Rated | 1h 23min | Drama, Thriller | 16 March 1967 (USA)",85 min,Writer: Ingmar Bergman (story),"Stars: Bibi Andersson, Liv Ullmann, Margaretha Krook | See full cast & crew »",Persona (1966),Persona Poster,Sound Mix: AGA Sound System,"http://ia.media-imdb.com/images/M/MV5BMTc1OTgxNjYyNF5BMl5BanBnXkFtZTcwNjM2MjM2NQ@@._V1_UX182_CR0,0,182,268_AL_.jpg",Genres: Drama | Thriller,"A young nurse, Alma, is put in charge of Elisabeth Vogler: an actress who is seemingly healthy in all respects, but will not talk. As they spend time together, Alma speaks to Elisabeth constantly, never receiving any answer. Alma eventually confesses her secrets to a seemingly sympathetic Elisabeth and finds that her own personality is being submerged into Elisabeth's persona. Written by Kathy Li",http://www.imdb.com/title/tt0060827/?pf_rd_m=A2FGELUUNOQJNL&pf_rd_p=2398042102&pf_rd_r=1X7MCR93P67MJYT56GA5&pf_rd_s=center-1&pf_rd_t=15506&pf_rd_i=top&ref_=chttp_tt_184
In the Name of the Father Poster,Director: Jim Sheridan,"R | 2h 13min | Biography, Drama, History | 25 February 1994 (USA)",133 min,"Writers: Gerry Conlon (autobiographical book ""Proved Innocent""), Terry George (screenplay) | 1 more credit »","Stars: Daniel Day-Lewis, Pete Postlethwaite, Alison Crosbie | See full cast & crew »",In the Name of the Father (1993),In the Name of the Father Poster,Show detailed company contact information on IMDbPro »,"http://ia.media-imdb.com/images/M/MV5BMTcwNjMyMzI0OV5BMl5BanBnXkFtZTgwMDU4NjkzMTE@._V1_UX182_CR0,0,182,268_AL_.jpg",Genres: Biography | Drama | History,"A small time thief from Belfast, Gerry Conlon, is falsely implicated in the IRA bombing of a pub that kills several people while he is in London. Bullied by the British police, he and four of his friends are coerced into confessing their guilt. Gerry's father and other relatives in London are also implicated in the crime. He spends 15 years in prison with his father trying to prove his innocence with the help of a British attorney, Gareth Peirce. Based on a true story. Written by Liza Esser <essereli@student.msu.edu>",http://www.imdb.com/title/tt0107207/?pf_rd_m=A2FGELUUNOQJNL&pf_rd_p=2398042102&pf_rd_r=1X7MCR93P67MJYT56GA5&pf_rd_s=center-1&pf_rd_t=15506&pf_rd_i=top&ref_=chttp_tt_185
12 Years a Slave Poster,Director: Steve McQueen,"R | 2h 14min | Biography, Drama, History | 8 November 2013 (USA)",134 min,"Writers: John Ridley (screenplay), Solomon Northup (based on ""Twelve Years a Slave"" by)","Stars: Chiwetel Ejiofor, Michael Kenneth Williams, Michael Fassbender | See full cast & crew »",12 Years a Slave (2013),12 Years a Slave Poster,"Gross: $56,667,870 (USA) (2 May 2014)","http://ia.media-imdb.com/images/M/MV5BMjExMTEzODkyN15BMl5BanBnXkFtZTcwNTU4NTc4OQ@@._V1_UX182_CR0,0,182,268_AL_.jpg",Genres: Biography | Drama | History,"Based on an incredible true story of one man's fight for survival and freedom. In the pre-Civil War United States, Solomon Northup (Chiwetel Ejiofor), a free black man from upstate New York, is abducted and sold into slavery. Facing cruelty (personified by a malevolent slave owner, portrayed by Michael Fassbender), as well as unexpected kindnesses, Solomon struggles not only to stay alive, but to retain his dignity. In the twelfth year of his unforgettable odyssey, Solomon's chance meeting with a Canadian abolitionist (Brad Pitt) will forever alter his life. Written by Fox Searchlight",http://www.imdb.com/title/tt2024544/?pf_rd_m=A2FGELUUNOQJNL&pf_rd_p=2398042102&pf_rd_r=1X7MCR93P67MJYT56GA5&pf_rd_s=center-1&pf_rd_t=15506&pf_rd_i=top&ref_=chttp_tt_186
Shutter Island Poster,Director: Martin Scorsese,"R | 2h 18min | Mystery, Thriller | 19 February 2010 (USA)",138 min,"Writers: Laeta Kalogridis (screenplay), Dennis Lehane (novel)","Stars: Leonardo DiCaprio, Emily Mortimer, Mark Ruffalo | See full cast & crew »",Shutter Island (2010),Shutter Island Poster,"Gross: $127,968,405 (USA) (4 June 2010)","http://ia.media-imdb.com/images/M/MV5BMTMxMTIyNzMxMV5BMl5BanBnXkFtZTcwOTc4OTI3Mg@@._V1_UX182_CR0,0,182,268_AL_.jpg",Genres: Mystery | Thriller,"It's 1954, and up-and-coming U.S. marshal Teddy Daniels is assigned to investigate the disappearance of a patient from Boston's Shutter Island Ashecliffe Hospital. He's been pushing for an assignment on the island for personal reasons, but before long he wonders whether he hasn't been brought there as part of a twisted plot by hospital doctors whose radical treatments range from unethical to illegal to downright sinister. Teddy's shrewd investigating skills soon provide a promising lead, but the hospital refuses him access to records he suspects would break the case wide open. As a hurricane cuts off communication with the mainland, more dangerous criminals ""escape"" in the confusion, and the puzzling, improbable clues multiply, Teddy begins to doubt everything - his memory, his partner, even his own sanity. Written by alfiehitchie",http://www.imdb.com/title/tt1130884/?pf_rd_m=A2FGELUUNOQJNL&pf_rd_p=2398042102&pf_rd_r=1X7MCR93P67MJYT56GA5&pf_rd_s=center-1&pf_rd_t=15506&pf_rd_i=top&ref_=chttp_tt_187
Amores Perros Poster,Director: Alejandro González Iñárritu,"R | 2h 34min | Drama, Thriller | 13 April 2001 (USA)",154 min,Writer: Guillermo Arriaga (as Guillermo Arriaga Jordán),"Stars: Emilio Echevarría, Gael García Bernal, Goya Toledo | See full cast & crew »",Amores Perros (2000),Amores Perros Poster,"Gross: $5,383,834 (USA) (6 July 2001)","http://ia.media-imdb.com/images/M/MV5BMjIyNTA5MzQ5N15BMl5BanBnXkFtZTcwNjIyNTgxMQ@@._V1_UY268_CR4,0,182,268_AL_.jpg",Genres: Drama | Thriller,"Three interconnected stories about the different strata of life in Mexico City all resolve with a fatal car accident. Octavio is trying to raise enough money to run away with his sister-in-law, and decides to enter his dog Cofi into the world of dogfighting. After a dogfight goes bad, Octavio flees in his car, running a red light and causing the accident. Daniel and Valeria's new-found bliss is prematurely ended when she loses her leg in the accident. El Chivo is a homeless man who cares for stray dogs and is there to witness the collision. Written by Anonymous",http://www.imdb.com/title/tt0245712/?pf_rd_m=A2FGELUUNOQJNL&pf_rd_p=2398042102&pf_rd_r=1X7MCR93P67MJYT56GA5&pf_rd_s=center-1&pf_rd_t=15506&pf_rd_i=top&ref_=chttp_tt_188
The Grand Budapest Hotel Poster,Director: Wes Anderson,"R | 1h 39min | Adventure, Comedy, Drama | 28 March 2014 (USA)",99 min,"Writers: Stefan Zweig (inspired by the writings of), Wes Anderson (screenplay) | 2 more credits »","Stars: Ralph Fiennes, F. Murray Abraham, Mathieu Amalric | See full cast & crew »",The Grand Budapest Hotel (2014),The Grand Budapest Hotel Poster,"Gross: $59,073,773 (USA) (22 August 2014)","http://ia.media-imdb.com/images/M/MV5BMzM5NjUxOTEyMl5BMl5BanBnXkFtZTgwNjEyMDM0MDE@._V1_UX182_CR0,0,182,268_AL_.jpg",,"GRAND BUDAPEST HOTEL recounts the adventures of Gustave H, a legendary concierge at a famous European hotel between the wars, and Zero Moustafa, the lobby boy who becomes his most trusted friend. The story involves the theft and recovery of a priceless Renaissance painting and the battle for an enormous family fortune -- all against the back-drop of a suddenly and dramatically changing Continent. Written by Fox Searchlight Pictures",http://www.imdb.com/title/tt2278388/?pf_rd_m=A2FGELUUNOQJNL&pf_rd_p=2398042102&pf_rd_r=1X7MCR93P67MJYT56GA5&pf_rd_s=center-1&pf_rd_t=15506&pf_rd_i=top&ref_=chttp_tt_189
The Princess Bride Poster,Director: Rob Reiner,"PG | 1h 38min | Adventure, Comedy, Family | 9 October 1987 (USA)",98 min,"Writers: William Goldman (book), William Goldman (screenplay)","Stars: Cary Elwes, Mandy Patinkin, Robin Wright | See full cast & crew »",The Princess Bride (1987),The Princess Bride Poster,"Production Co: Act III Communications, Buttercup Films Ltd., The Princess Bride Ltd. See more »","http://ia.media-imdb.com/images/M/MV5BMTkzMDgyNjQwM15BMl5BanBnXkFtZTgwNTg2Mjc1MDE@._V1_UX182_CR0,0,182,268_AL_.jpg",Genres: Adventure | Comedy | Family | Fantasy | Romance,"An elderly man reads the book ""The Princess Bride"" to his sick and thus currently bedridden adolescent grandson, the reading of the book which has been passed down within the family for generations. The grandson is sure he won't like the story, with a romance at its core, he preferring something with lots of action and ""no kissing"". But the grandson is powerless to stop his grandfather, whose feelings he doesn't want to hurt. The story centers on Buttercup, a former farm girl who has been chosen as the princess bride to Prince Humperdinck of Florian. Buttercup does not love him, she who still laments the death of her one true love, Westley, five years ago. Westley was a hired hand on the farm, his stock answer of ""as you wish"" to any request she made of him which she came to understand was his way of saying that he loved her. But Westley went away to sea, only to be killed by the Dread Pirate Roberts. On a horse ride to clear her mind of her upcoming predicament of marriage, Buttercup... Written by Huggo",http://www.imdb.com/title/tt0093779/?pf_rd_m=A2FGELUUNOQJNL&pf_rd_p=2398042102&pf_rd_r=1X7MCR93P67MJYT56GA5&pf_rd_s=center-1&pf_rd_t=15506&pf_rd_i=top&ref_=chttp_tt_190
Touch of Evil Poster,Director: Orson Welles,"PG-13 | 1h 35min | Crime, Film-Noir, Thriller | 1 May 1958 (UK)",95 min,"Writers: Orson Welles (screenplay), Whit Masterson (based on the novel ""Badge Of Evil"" by)","Stars: Charlton Heston, Orson Welles, Janet Leigh | See full cast & crew »",Touch of Evil (1958),Touch of Evil Poster,Production Co: Universal International Pictures (UI) See more »,"http://ia.media-imdb.com/images/M/MV5BMTY3NjIwMDY4M15BMl5BanBnXkFtZTgwODMwODgyMTE@._V1_UX182_CR0,0,182,268_AL_.jpg",Genres: Crime | Film-Noir | Thriller,"Mexican Narcotics officer Ramon Miguel 'Mike' Vargas has to interrupt his honeymoon on the Mexican-US border when an American building contractor is killed after someone places a bomb in his car. He's killed on the US side of the border but it's clear that the bomb was planted on the Mexican side. As a result, Vargas delays his return to Mexico City where he has been mounting a case against the Grandi family crime and narcotics syndicate. Police Captain Hank Quinlan is in charge on the US side and he soon has a suspect, a Mexican named Manolo Sanchez. Vargas is soon onto Quinlan and his Sergeant, Pete Menzies, when he catches them planting evidence to convict Sanchez. With his new American wife, Susie, safely tucked away in a hotel on the US side of the border - or so he thinks - he starts to review Quinlan's earlier cases. While concentrating on the corrupt policeman however, the Grandis have their own plans for Vargas and they start with his wife Susie. Written by garykmcd",http://www.imdb.com/title/tt0052311/?pf_rd_m=A2FGELUUNOQJNL&pf_rd_p=2398042102&pf_rd_r=1X7MCR93P67MJYT56GA5&pf_rd_s=center-1&pf_rd_t=15506&pf_rd_i=top&ref_=chttp_tt_191
Million Dollar Baby Poster,Director: Clint Eastwood,"PG-13 | 2h 12min | Drama, Sport | 28 January 2005 (USA)",132 min,"Writers: Paul Haggis (screenplay), F.X. Toole (stories)","Stars: Hilary Swank, Clint Eastwood, Morgan Freeman | See full cast & crew »",Million Dollar Baby (2004),Million Dollar Baby Poster,"Gross: $100,422,786 (USA) (3 June 2005)","http://ia.media-imdb.com/images/M/MV5BMTkxNzA1NDQxOV5BMl5BanBnXkFtZTcwNTkyMTIzMw@@._V1_UX182_CR0,0,182,268_AL_.jpg",Genres: Drama | Sport,"Wanting to learn from the best, aspiring boxer Maggie Fitzgerald wants Frankie Dunn to train her. At the outset he flatly refuses saying he has no interest in training a girl. Frankie leads a lonely existence, alienated from his only daughter and having few friends. She's rough around the edges but shows a lot of grit in the ring and he eventually relents. Maggie not only proves to be the boxer he always dreamed of having under his wing but a friend who fills the great void he's had in his life. Maggie's career skyrockets but an accident in the ring leads her to ask Frankie for one last favor. Written by garykmcd",http://www.imdb.com/title/tt0405159/?pf_rd_m=A2FGELUUNOQJNL&pf_rd_p=2398042102&pf_rd_r=1X7MCR93P67MJYT56GA5&pf_rd_s=center-1&pf_rd_t=15506&pf_rd_i=top&ref_=chttp_tt_192
Ben-Hur Poster,Director: William Wyler,"G | 3h 32min | Adventure, Drama, War | 26 December 1959 (UK)",212 min,"Writers: Lew Wallace (novel) (as General Lew Wallace), Karl Tunberg (screenplay)","Stars: Charlton Heston, Jack Hawkins, Stephen Boyd | See full cast & crew »",Ben-Hur (1959),Ben-Hur Poster,Production Co: Metro-Goldwyn-Mayer (MGM) See more »,"http://ia.media-imdb.com/images/M/MV5BNjg2NjA3NDY2OV5BMl5BanBnXkFtZTgwNzE3NTkxMTE@._V1_UX182_CR0,0,182,268_AL_.jpg",Genres: Adventure | Drama | War,"Judah Ben-Hur lives as a rich Jewish prince and merchant in Jerusalem at the beginning of the 1st century. Together with the new governor his old friend Messala arrives as commanding officer of the Roman legions. At first they are happy to meet after a long time but their different politic views separate them. During the welcome parade a roof tile falls down from Judah's house and injures the governor. Although Messala knows they are not guilty, he sends Judah to the galleys and throws his mother and sister into prison. But Judah swears to come back and take revenge. Written by Matthias Scheler <tron@lyssa.owl.de>",http://www.imdb.com/title/tt0052618/?pf_rd_m=A2FGELUUNOQJNL&pf_rd_p=2398042102&pf_rd_r=1X7MCR93P67MJYT56GA5&pf_rd_s=center-1&pf_rd_t=15506&pf_rd_i=top&ref_=chttp_tt_193
Annie Hall Poster,Director: Woody Allen,"PG | 1h 33min | Comedy, Romance | 20 April 1977 (USA)",93 min,"Writers: Woody Allen, Marshall Brickman","Stars: Woody Allen, Diane Keaton, Tony Roberts | See full cast & crew »",Annie Hall (1977),Annie Hall Poster,Production Co: Rollins-Joffe Productions See more »,"http://ia.media-imdb.com/images/M/MV5BMTU1NDM2MjkwM15BMl5BanBnXkFtZTcwODU3OTYwNA@@._V1_UX182_CR0,0,182,268_AL_.jpg",Genres: Comedy | Romance,"Alvy Singer, a forty year old twice divorced, neurotic, intellectual Jewish New York stand-up comic, reflects on the demise of his latest relationship, to Annie Hall, an insecure, flighty, Midwestern WASP aspiring nightclub singer. Unlike his previous relationships, Alvy believed he may have worked out all the issues in his life through fifteen years of therapy to make this relationship with Annie last, among those issues being not wanting to date any woman that would want to date him, and thus subconsciously pushing those women away. Alvy not only reviews the many ups and many downs of their relationship, but also reviews the many facets of his makeup that led to him starting to date Annie. Those facets include growing up next to Coney Island in Brooklyn, being attracted to the opposite sex for as long as he can remember, and enduring years of Jewish guilt with his constantly arguing parents. Written by Huggo",http://www.imdb.com/title/tt0075686/?pf_rd_m=A2FGELUUNOQJNL&pf_rd_p=2398042102&pf_rd_r=1X7MCR93P67MJYT56GA5&pf_rd_s=center-1&pf_rd_t=15506&pf_rd_i=top&ref_=chttp_tt_194
The Grapes of Wrath Poster,Director: John Ford,Not Rated | 2h 9min | Drama | 15 March 1940 (USA),129 min,"Writers: Nunnally Johnson (screen play), John Steinbeck (based on the novel by)","Stars: Henry Fonda, Jane Darwell, John Carradine | See full cast & crew »",The Grapes of Wrath (1940),The Grapes of Wrath Poster,Runtime: 129 min | 108 min (cut),"http://ia.media-imdb.com/images/M/MV5BMzgzNjcxNjg2M15BMl5BanBnXkFtZTcwMjQxNDQ3Mg@@._V1_UX182_CR0,0,182,268_AL_.jpg",Genres: Drama,"Tom Joad returns to his home after a jail sentence to find his family kicked out of their farm due to foreclosure. He catches up with them on his Uncles farm, and joins them the next day as they head for California and a new life... Hopefully. Written by Colin Tinto <cst@imdb.com>",http://www.imdb.com/title/tt0032551/?pf_rd_m=A2FGELUUNOQJNL&pf_rd_p=2398042102&pf_rd_r=1X7MCR93P67MJYT56GA5&pf_rd_s=center-1&pf_rd_t=15506&pf_rd_i=top&ref_=chttp_tt_195
Wild Tales Poster,Director: Damián Szifrón (as Damián Szifron),"R | 2h 2min | Comedy, Drama, Thriller | 21 August 2014 (Argentina)",122 min,Writer: Damián Szifrón (as Damián Szifron),"Stars: Darío Grandinetti, María Marull, Mónica Villa | See full cast & crew »",Wild Tales (2014),Wild Tales Poster,"Gross: $3,079,012 (USA) (26 June 2015)","http://ia.media-imdb.com/images/M/MV5BNzAzMjA1ODAxOV5BMl5BanBnXkFtZTgwODg4NTQzNDE@._V1_UX182_CR0,0,182,268_AL_.jpg",Genres: Comedy | Drama | Thriller,"The film is divided into six segments. (1) ""Pasternak"": While being on a plane, a model and a music critic realise they have a common acquaintance called Pasternak. Soon they discover that every passenger and crew member on board know Pasternak. Is this coincidence? (2) ""The Rats"": A waitress recognizes her client - it's the loan shark who caused a tragedy in her family. The cook suggests mixing rat poison with his food, but the waitress refuses. The stubborn cook, however, decides to proceed with her plan. (3) ""The Strongest"": Two drivers on a lone highway have an argument with tragic consequences. (4) ""Little Bomb"": A demolition engineer has his car towed by a truck for parking in a wrong place and he has an argument with the employee of the towing company. This event destroys his private and professional life, and he plots revenge against the corrupt towing company and the city hall. (5) ""The Proposal"": A reckless son of a wealthy family has an overnight hit-and-run accident, in ... Written by Claudio Carvalho, Rio de Janeiro, Brazil",http://www.imdb.com/title/tt3011894/?pf_rd_m=A2FGELUUNOQJNL&pf_rd_p=2398042102&pf_rd_r=1X7MCR93P67MJYT56GA5&pf_rd_s=center-1&pf_rd_t=15506&pf_rd_i=top&ref_=chttp_tt_196
Hachi: A Dog's Tale Poster,Director: Lasse Hallström,"G | 1h 33min | Drama, Family | 12 March 2010 (UK)",93 min,"Writers: Stephen P. Lindsey (screenplay), Kaneto Shindô (motion picture ""Hachiko monogatari"")","Stars: Richard Gere, Joan Allen, Cary-Hiroyuki Tagawa | See full cast & crew »",Hachi: A Dog's Tale (2009),Hachi: A Dog's Tale Poster,"Gross: £1,048,876 (UK) (26 March 2010)","http://ia.media-imdb.com/images/M/MV5BMTAxMDA2MjM4NDReQTJeQWpwZ15BbWU3MDE0NTgxMTM@._V1_UY268_CR2,0,182,268_AL_.jpg",Genres: Drama | Family,"In Bedridge, Professor Parker Wilson finds an abandoned dog at the train station and takes it home with the intention of returning the animal to its owner. He finds that the dog is an Akita and names it Hachiko. However, nobody claims the dog so his family decides to keep Hachi. Written by Claudio Carvalho, Rio de Janeiro, Brazil",http://www.imdb.com/title/tt1028532/?pf_rd_m=A2FGELUUNOQJNL&pf_rd_p=2398042102&pf_rd_r=1X7MCR93P67MJYT56GA5&pf_rd_s=center-1&pf_rd_t=15506&pf_rd_i=top&ref_=chttp_tt_197
Nausicaä of the Valley of the Wind Poster,Director: Hayao Miyazaki,"PG | 1h 57min | Animation, Adventure, Fantasy | 11 March 1984 (Japan)",117 min,"Writers: Hayao Miyazaki (comic), Hayao Miyazaki (screenplay) | 1 more credit »","Stars: Sumi Shimamoto, Mahito Tsujimura, Hisako Kyôda | See full cast & crew »",Nausicaä of the Valley of the Wind (1984),Nausicaä of the Valley of the Wind Poster,Runtime: 117 min | 95 min (1985) (edited),"http://ia.media-imdb.com/images/M/MV5BMTM1NjIxNTY4OF5BMl5BanBnXkFtZTcwNDE5MDIyNw@@._V1_UY268_CR4,0,182,268_AL_.jpg",Genres: Animation | Adventure | Fantasy | Sci-Fi,"An animated fantasy-adventure. Set 1,000 years from now, the earth is ravaged by pollution and war. In the Valley of the Wind lives Nausicaa, princess of her people. Their land borders on a toxic jungle, filled with dangerous over-sized insects. Meanwhile two nearby nations are bitterly engaged in a war and the Valley of the Wind is stuck in the middle... Written by grantss",http://www.imdb.com/title/tt0087544/?pf_rd_m=A2FGELUUNOQJNL&pf_rd_p=2398042102&pf_rd_r=1X7MCR93P67MJYT56GA5&pf_rd_s=center-1&pf_rd_t=15506&pf_rd_i=top&ref_=chttp_tt_198
