movieimg/_alt,director,rating/duration/genre/releasedate,runtime,writers,stars,title,movieimg/_title,productioncompany,movieimg,genres,desc,pageUrl
Room Poster,Director: Lenny Abrahamson,R | 1h 58min | Drama | 22 January 2016 (USA),118 min,"Writers: Emma Donoghue (screenplay), Emma Donoghue (based on the novel by)","Stars: Brie Larson, Jacob Tremblay, Sean Bridgers | See full cast & crew »",Room (2015),Room Poster,"Gross: $14,318,503 (USA) (11 March 2016)","http://ia.media-imdb.com/images/M/MV5BMjE4NzgzNzEwMl5BMl5BanBnXkFtZTgwMTMzMDE0NjE@._V1_UX182_CR0,0,182,268_AL_.jpg",Genres: Drama,"ROOM tells the extraordinary story of Jack, a spirited 5-year-old who is looked after by his loving and devoted mother. Like any good mother, Ma dedicates herself to keeping Jack happy and safe, nurturing him with warmth and love and doing typical things like playing games and telling stories. Their life, however, is anything but typical--they are trapped--confined to a 10-by-10-foot space that Ma has euphemistically named Room. Ma has created a whole universe for Jack within Room, and she will stop at nothing to ensure that, even in this treacherous environment, Jack is able to live a complete and fulfilling life. But as Jack's curiosity about their situation grows, and Ma's resilience reaches its breaking point, they enact a risky plan to escape, ultimately bringing them face-to-face with what may turn out to be the scariest thing yet: the real world. Written by A24",http://www.imdb.com/title/tt3170832/?pf_rd_m=A2FGELUUNOQJNL&pf_rd_p=2398042102&pf_rd_r=1X7MCR93P67MJYT56GA5&pf_rd_s=center-1&pf_rd_t=15506&pf_rd_i=top&ref_=chttp_tt_120
Downfall Poster,Director: Oliver Hirschbiegel,"R | 2h 36min | Biography, Drama, History | 8 April 2005 (USA)",156 min,"Writers: Bernd Eichinger (screenplay), Joachim Fest (book) | 2 more credits »","Stars: Bruno Ganz, Alexandra Maria Lara, Ulrich Matthes | See full cast & crew »",Downfall (2004),Downfall Poster,"Gross: $1,288,633 (Brazil) (8 July 2005)","http://ia.media-imdb.com/images/M/MV5BMTM1OTI1MjE2Nl5BMl5BanBnXkFtZTcwMTEwMzc4NA@@._V1_UX182_CR0,0,182,268_AL_.jpg",Genres: Biography | Drama | History | War,"In April of 1945, Germany stands at the brink of defeat with the Soviet Armies closing in from the west and south. In Berlin, capital of the Third Reich, Adolf Hitler proclaims that Germany will still achieve victory and orders his Generals and advisers to fight to the last man. ""Downfall"" explores these final days of the Reich, where senior German leaders (such as Himmler and Goring) began defecting from their beloved Fuhrer, in an effort to save their own lives, while still others (Joseph Goebbels) pledge to die with Hitler. Hitler, himself, degenerates into a paranoid shell of a man, full of optimism one moment and suicidal depression the next. When the end finally does comes, and Hitler lies dead by his own hand, what is left of his military must find a way to end the killing that is the Battle of Berlin, and lay down their arms in surrender. Written by Anthony Hughes {husnock31@hotmail.com}",http://www.imdb.com/title/tt0363163/?pf_rd_m=A2FGELUUNOQJNL&pf_rd_p=2398042102&pf_rd_r=1X7MCR93P67MJYT56GA5&pf_rd_s=center-1&pf_rd_t=15506&pf_rd_i=top&ref_=chttp_tt_121
Die Hard Poster,Director: John McTiernan,"R | 2h 11min | Action, Thriller | 20 July 1988 (USA)",131 min,"Writers: Roderick Thorp (novel), Jeb Stuart (screenplay) | 1 more credit »","Stars: Bruce Willis, Alan Rickman, Bonnie Bedelia | See full cast & crew »",Die Hard (1988),Die Hard Poster,"Production Co: Twentieth Century Fox Film Corporation, Gordon Company, Silver Pictures See more »","http://ia.media-imdb.com/images/M/MV5BMTY4ODM0OTc2M15BMl5BanBnXkFtZTcwNzE0MTk3OA@@._V1_UX182_CR0,0,182,268_AL_.jpg",Genres: Action | Thriller,"NYPD cop John McClane goes on a Christmas vacation to visit his wife Holly in Los Angeles where she works for the Nakatomi Corporation. While they are at the Nakatomi headquarters for a Christmas party, a group of bank robbers led by Hans Gruber take control of the building and hold everyone hostage, with the exception of John, while they plan to perform a lucrative heist. Unable to escape and with no immediate police response, John is forced to take matters into his own hands. Written by Sam",http://www.imdb.com/title/tt0095016/?pf_rd_m=A2FGELUUNOQJNL&pf_rd_p=2398042102&pf_rd_r=1X7MCR93P67MJYT56GA5&pf_rd_s=center-1&pf_rd_t=15506&pf_rd_i=top&ref_=chttp_tt_122
Chinatown Poster,Director: Roman Polanski,"R | 2h 10min | Drama, Mystery, Thriller | 20 June 1974 (USA)",130 min,Writer: Robert Towne,"Stars: Jack Nicholson, Faye Dunaway, John Huston | See full cast & crew »",Chinatown (1974),Chinatown Poster,Runtime: 130 min,"http://ia.media-imdb.com/images/M/MV5BMTUyMTQ1NjA2OV5BMl5BanBnXkFtZTcwODQ1Njg3OA@@._V1_UX182_CR0,0,182,268_AL_.jpg",,"JJ 'Jake' Gittes is a private detective who seems to specialize in matrimonial cases. He is hired by Evelyn Mulwray when she suspects her husband Hollis, builder of the city's water supply system, of having an affair. Gittes does what he does best and photographs him with a young girl but in the ensuing scandal, it seems he was hired by an impersonator and not the real Mrs. Mulwray. When Mr. Mulwray is found dead, Jake is plunged into a complex web of deceit involving murder, incest and municipal corruption all related to the city's water supply. Written by garykmcd",http://www.imdb.com/title/tt0071315/?pf_rd_m=A2FGELUUNOQJNL&pf_rd_p=2398042102&pf_rd_r=1X7MCR93P67MJYT56GA5&pf_rd_s=center-1&pf_rd_t=15506&pf_rd_i=top&ref_=chttp_tt_123
The Great Escape Poster,Director: John Sturges,"Approved | 2h 52min | Adventure, Drama, History | 4 July 1963 (USA)",172 min,"Writers: Paul Brickhill (book), James Clavell (screenplay) | 1 more credit »","Stars: Steve McQueen, James Garner, Richard Attenborough | See full cast & crew »",The Great Escape (1963),The Great Escape Poster,Runtime: 172 min,"http://ia.media-imdb.com/images/M/MV5BMjI2MTQwNDI3Nl5BMl5BanBnXkFtZTcwNDk4MTkzNA@@._V1_UX182_CR0,0,182,268_AL_.jpg",Genres: Adventure | Drama | History | Thriller | War,"Based on a true story, a group of allied escape artist-type prisoners-of-war (POW's) are all put in an 'escape proof' camp. Their leader decides to try to take out several hundred all at once. The first half of the film is played for comedy as the prisoners mostly outwit their jailers to dig the escape tunnel. The second half is high adventure as they use boats and trains and planes to get out of occupied Europe. Written by John Vogel <jlvogel@comcast.net>",http://www.imdb.com/title/tt0057115/?pf_rd_m=A2FGELUUNOQJNL&pf_rd_p=2398042102&pf_rd_r=1X7MCR93P67MJYT56GA5&pf_rd_s=center-1&pf_rd_t=15506&pf_rd_i=top&ref_=chttp_tt_124
Heat Poster,Director: Michael Mann,"R | 2h 50min | Action, Crime, Drama | 15 December 1995 (USA)",170 min,Writer: Michael Mann,"Stars: Al Pacino, Robert De Niro, Val Kilmer | See full cast & crew »",Heat (1995),Heat Poster,Show detailed company contact information on IMDbPro »,"http://ia.media-imdb.com/images/M/MV5BMTM1NDc4ODkxNV5BMl5BanBnXkFtZTcwNTI4ODE3MQ@@._V1_UY268_CR1,0,182,268_AL_.jpg",Genres: Action | Crime | Drama | Thriller,"Hunters and their prey--Neil and his professional criminal crew hunt to score big money targets (banks, vaults, armored cars) and are, in turn, hunted by Lt. Vincent Hanna and his team of cops in the Robbery/Homicide police division. A botched job puts Hanna onto their trail while they regroup and try to put together one last big 'retirement' score. Neil and Vincent are similar in many ways, including their troubled personal lives. At a crucial moment in his life, Neil disobeys the dictum taught to him long ago by his criminal mentor--'Never have anything in your life that you can't walk out on in thirty seconds flat, if you spot the heat coming around the corner'--as he falls in love. Thus the stage is set for the suspenseful ending.... Written by Tad Dibbern <DIBBERN_D@a1.mscf.upenn.edu>",http://www.imdb.com/title/tt0113277/?pf_rd_m=A2FGELUUNOQJNL&pf_rd_p=2398042102&pf_rd_r=1X7MCR93P67MJYT56GA5&pf_rd_s=center-1&pf_rd_t=15506&pf_rd_i=top&ref_=chttp_tt_125
On the Waterfront Poster,Director: Elia Kazan,"Not Rated | 1h 48min | Crime, Drama, Romance | 22 June 1954 (Japan)",108 min,"Writers: Budd Schulberg (screenplay), Budd Schulberg (based upon an original story by) | 1 more credit »","Stars: Marlon Brando, Karl Malden, Lee J. Cobb | See full cast & crew »",On the Waterfront (1954),On the Waterfront Poster,"Production Co: Columbia Pictures Corporation, Horizon Pictures See more »","http://ia.media-imdb.com/images/M/MV5BMTcwMTU3MjI1OV5BMl5BanBnXkFtZTgwNjE2OTI3MjE@._V1_UY268_CR4,0,182,268_AL_.jpg",Genres: Crime | Drama | Romance,"Terry Malloy dreams about being a prize fighter, while tending his pigeons and running errands at the docks for Johnny Friendly, the corrupt boss of the dockers union. Terry witnesses a murder by two of Johnny's thugs, and later meets the dead man's sister and feels responsible for his death. She introduces him to Father Barry, who tries to force him to provide information for the courts that will smash the dock racketeers. Written by Colin Tinto <cst@imdb.com>",http://www.imdb.com/title/tt0047296/?pf_rd_m=A2FGELUUNOQJNL&pf_rd_p=2398042102&pf_rd_r=1X7MCR93P67MJYT56GA5&pf_rd_s=center-1&pf_rd_t=15506&pf_rd_i=top&ref_=chttp_tt_126
Pan's Labyrinth Poster,Director: Guillermo del Toro,"R | 1h 58min | Drama, Fantasy, War | 19 January 2007 (USA)",118 min,Writer: Guillermo del Toro,"Stars: Ivana Baquero, Ariadna Gil, Sergi López | See full cast & crew »",Pan's Labyrinth (2006),Pan's Labyrinth Poster,"Gross: $37,623,143 (USA) (8 June 2007)","http://ia.media-imdb.com/images/M/MV5BMTU3ODg2NjQ5NF5BMl5BanBnXkFtZTcwMDEwODgzMQ@@._V1_UY268_CR0,0,182,268_AL_.jpg",Genres: Drama | Fantasy | War,"In 1944 falangist Spain, a girl, fascinated with fairy-tales, is sent along with her pregnant mother to live with her new stepfather, a ruthless captain of the Spanish army. During the night, she meets a fairy who takes her to an old faun in the center of the labyrinth. He tells her she's a princess, but must prove her royalty by surviving three gruesome tasks. If she fails, she will never prove herself to be the the true princess and will never see her real father, the king, again. Written by Tim",http://www.imdb.com/title/tt0457430/?pf_rd_m=A2FGELUUNOQJNL&pf_rd_p=2398042102&pf_rd_r=1X7MCR93P67MJYT56GA5&pf_rd_s=center-1&pf_rd_t=15506&pf_rd_i=top&ref_=chttp_tt_127
My Neighbor Totoro Poster,Director: Hayao Miyazaki,"G | 1h 26min | Animation, Family, Fantasy | 16 April 1988 (Japan)",86 min,Writer: Hayao Miyazaki,"Stars: Hitoshi Takagi, Noriko Hidaka, Chika Sakamoto | See full cast & crew »",My Neighbor Totoro (1988),My Neighbor Totoro Poster,Runtime: 86 min,"http://ia.media-imdb.com/images/M/MV5BMjE3NzY5ODQwMV5BMl5BanBnXkFtZTcwNzY1NzcxNw@@._V1_UY268_CR6,0,182,268_AL_.jpg",,"Two young girls, Satsuki and her younger sister Mei, move into a house in the country with their father to be closer to their hospitalized mother. Satsuki and Mei discover that the nearby forest is inhabited by magical creatures called Totoros (pronounced toe-toe-ro). They soon befriend these Totoros, and have several magical adventures. Written by Christopher E. Meadows <cmeadows@nyx.cs.du.edu>",http://www.imdb.com/title/tt0096283/?pf_rd_m=A2FGELUUNOQJNL&pf_rd_p=2398042102&pf_rd_r=1X7MCR93P67MJYT56GA5&pf_rd_s=center-1&pf_rd_t=15506&pf_rd_i=top&ref_=chttp_tt_128
Sunrise Poster,Director: F.W. Murnau,"Not Rated | 1h 34min | Drama, Romance | 4 November 1927 (USA)",94 min,"Writers: Carl Mayer (scenario), Hermann Sudermann (from an original theme by) | 2 more credits »","Stars: George O'Brien, Janet Gaynor, Margaret Livingston | See full cast & crew »",Sunrise (1927),Sunrise Poster,Color: Black and White,"http://ia.media-imdb.com/images/M/MV5BMjIzNzg4MzcxNV5BMl5BanBnXkFtZTgwMTgzNTE0MTE@._V1_UX182_CR0,0,182,268_AL_.jpg",,"In this fable-morality subtitled ""A Song of Two Humans"", the ""evil"" temptress is a city woman who bewitches farmer Anses and tries to convince him to murder his neglected wife, Indre. Written by alfiehitchie",http://www.imdb.com/title/tt0018455/?pf_rd_m=A2FGELUUNOQJNL&pf_rd_p=2398042102&pf_rd_r=1X7MCR93P67MJYT56GA5&pf_rd_s=center-1&pf_rd_t=15506&pf_rd_i=top&ref_=chttp_tt_129
Mr. Smith Goes to Washington Poster,Director: Frank Capra,Not Rated | 2h 9min | Drama | 19 October 1939 (USA),129 min,"Writers: Sidney Buchman (screen play), Lewis R. Foster (story)","Stars: James Stewart, Jean Arthur, Claude Rains | See full cast & crew »",Mr. Smith Goes to Washington (1939),Mr. Smith Goes to Washington Poster,Runtime: 129 min | 120 min (TV),"http://ia.media-imdb.com/images/M/MV5BMjAwMzU5ODkwNF5BMl5BanBnXkFtZTcwNTg4Mjk3OA@@._V1_UX182_CR0,0,182,268_AL_.jpg",Genres: Drama,"Naive and idealistic Jefferson Smith, leader of the Boy Rangers, is appointed on a lark by the spineless governor of his state. He is reunited with the state's senior senator--presidential hopeful and childhood hero, Senator Joseph Paine. In Washington, however, Smith discovers many of the shortcomings of the political process as his earnest goal of a national boys' camp leads to a conflict with the state political boss, Jim Taylor. Taylor first tries to corrupt Smith and then later attempts to destroy Smith through a scandal. Written by James Yu <jamestyu@ccwf.cc.utexas.edu>",http://www.imdb.com/title/tt0031679/?pf_rd_m=A2FGELUUNOQJNL&pf_rd_p=2398042102&pf_rd_r=1X7MCR93P67MJYT56GA5&pf_rd_s=center-1&pf_rd_t=15506&pf_rd_i=top&ref_=chttp_tt_130
Ikiru Poster,Director: Akira Kurosawa,Not Rated | 2h 23min | Drama | 25 March 1956 (USA),143 min,"Writers: Akira Kurosawa, Shinobu Hashimoto | 1 more credit »","Stars: Takashi Shimura, Nobuo Kaneko, Shin'ichi Himori | See full cast & crew »",Ikiru (1952),Ikiru Poster,Show detailed company contact information on IMDbPro »,"http://ia.media-imdb.com/images/M/MV5BMTcyMDU0MTQzNV5BMl5BanBnXkFtZTcwOTk2NDQyMQ@@._V1._CR12,28,314,446_UY268_CR3,0,182,268_AL_.jpg",,"Kanji Watanabe is a longtime bureaucrat in a city office who, along with the rest of the office, spends his entire working life doing nothing. He learns he is dying of cancer and wants to find some meaning in his life. He finds himself unable to talk with his family, and spends a night on the town with a novelist, but that leaves him unfulfilled. He next spends time with a young woman from his office, but finally decides he can make a difference through his job... After Watanabe's death, co-workers at his funeral discuss his behavior over the last several months and debate why he suddenly became assertive in his job to promote a city park, and resolve to be more like Watanabe. Written by Mike Rosenlof <mrosenlof@qualcomm.com>",http://www.imdb.com/title/tt0044741/?pf_rd_m=A2FGELUUNOQJNL&pf_rd_p=2398042102&pf_rd_r=1X7MCR93P67MJYT56GA5&pf_rd_s=center-1&pf_rd_t=15506&pf_rd_i=top&ref_=chttp_tt_131
The Bridge on the River Kwai Poster,Director: David Lean,"Approved | 2h 41min | Adventure, Drama, War | 14 December 1957 (USA)",161 min,"Writers: Pierre Boulle (novel), Carl Foreman (screenplay) | 1 more credit »","Stars: William Holden, Alec Guinness, Jack Hawkins | See full cast & crew »",The Bridge on the River Kwai (1957),The Bridge on the River Kwai Poster,Show detailed company contact information on IMDbPro »,"http://ia.media-imdb.com/images/M/MV5BMTc2NzA0NTEwNF5BMl5BanBnXkFtZTcwMzA0MTk3OA@@._V1_UX182_CR0,0,182,268_AL_.jpg",Genres: Adventure | Drama | War,"The film deals with the situation of British prisoners of war during World War II who are ordered to build a bridge to accommodate the Burma-Siam railway. Their instinct is to sabotage the bridge but, under the leadership of Colonel Nicholson, they are persuaded that the bridge should be constructed as a symbol of British morale, spirit and dignity in adverse circumstances. At first, the prisoners admire Nicholson when he bravely endures torture rather than compromise his principles for the benefit of the Japanese commandant Saito. He is an honorable but arrogant man, who is slowly revealed to be a deluded obsessive. He convinces himself that the bridge is a monument to British character, but actually is a monument to himself, and his insistence on its construction becomes a subtle form of collaboration with the enemy. Unknown to him, the Allies have sent a mission into the jungle, led by Warden and an American, Shears, to blow up the bridge. Written by alfiehitchie",http://www.imdb.com/title/tt0050212/?pf_rd_m=A2FGELUUNOQJNL&pf_rd_p=2398042102&pf_rd_r=1X7MCR93P67MJYT56GA5&pf_rd_s=center-1&pf_rd_t=15506&pf_rd_i=top&ref_=chttp_tt_132
The Gold Rush Poster,Director: Charles Chaplin,"Not Rated | 1h 35min | Adventure, Comedy, Drama | 1925 (Germany)",95 min,Writer: Charles Chaplin,"Stars: Charles Chaplin, Mack Swain, Tom Murray | See full cast & crew »",The Gold Rush (1925),The Gold Rush Poster,Runtime: 95 min (original) | 72 min (1942 re-release) | 81 min (edited),"http://ia.media-imdb.com/images/M/MV5BMzYzMDQyNzA4NV5BMl5BanBnXkFtZTYwNDU5NDU5._V1_UY268_CR7,0,182,268_AL_.jpg",,A lone prospector ventures into Alaska looking for gold. He gets mixed up with some burly characters and falls in love with the beautiful Georgia. He tries to win her heart with his singular charm. Written by John J. Magee <magee@helix.mgh.harvard.edu>,http://www.imdb.com/title/tt0015864/?pf_rd_m=A2FGELUUNOQJNL&pf_rd_p=2398042102&pf_rd_r=1X7MCR93P67MJYT56GA5&pf_rd_s=center-1&pf_rd_t=15506&pf_rd_i=top&ref_=chttp_tt_133
Ran Poster,Director: Akira Kurosawa,"R | 2h 42min | Action, Drama, War | 1 June 1985 (Japan)",162 min,"Writers: Akira Kurosawa (screenplay), Hideo Oguni (screenplay) | 2 more credits »","Stars: Tatsuya Nakadai, Akira Terao, Jinpachi Nezu | See full cast & crew »",Ran (1985),Ran Poster,"Production Co: Greenwich Film Productions, Herald Ace, Nippon Herald Films See more »","http://ia.media-imdb.com/images/M/MV5BNTEyNjg0MDM4OF5BMl5BanBnXkFtZTgwODI0NjUxODE@._V1_UY268_CR2,0,182,268_AL_.jpg",,"Japanese warlord Hidetori Ichimonji decides the time has come to retire and divide his fiefdom among his three sons. His eldest and middle sons - Taro and Jiro - agree with his decision and promise to support him for his remaining days. The youngest son Saburo disagrees with all of them arguing that there is little likelihood the three brothers will remain united. Insulted by his son's brashness, the warlord banishes Saburo. As the warlord begins his retirement, he quickly realizes that his two eldest sons selfish and have no intention of keeping their promises. It leads to war and only banished Saburo c an possibly save him. Written by garykmcd",http://www.imdb.com/title/tt0089881/?pf_rd_m=A2FGELUUNOQJNL&pf_rd_p=2398042102&pf_rd_r=1X7MCR93P67MJYT56GA5&pf_rd_s=center-1&pf_rd_t=15506&pf_rd_i=top&ref_=chttp_tt_134
The Seventh Seal Poster,Director: Ingmar Bergman,"Not Rated | 1h 36min | Drama, Fantasy | 13 October 1958 (USA)",96 min,"Writers: Ingmar Bergman (play), Ingmar Bergman (screenplay)","Stars: Max von Sydow, Gunnar Björnstrand, Bengt Ekerot | See full cast & crew »",The Seventh Seal (1957),The Seventh Seal Poster,Runtime: 96 min,"http://ia.media-imdb.com/images/M/MV5BMTUzODUyNjkxM15BMl5BanBnXkFtZTcwODA5MTM1Mg@@._V1_UY268_CR4,0,182,268_AL_.jpg",,"A Knight and his squire are home from the crusades. Black Death is sweeping their country. As they approach home, Death appears to the knight and tells him it is his time. The knight challenges Death to a chess game for his life. The Knight and Death play as the cultural turmoil envelopes the people around them as they try, in different ways, to deal with the upheaval the plague has caused. Written by John Vogel <jlvogel@comcast.net>",http://www.imdb.com/title/tt0050976/?pf_rd_m=A2FGELUUNOQJNL&pf_rd_p=2398042102&pf_rd_r=1X7MCR93P67MJYT56GA5&pf_rd_s=center-1&pf_rd_t=15506&pf_rd_i=top&ref_=chttp_tt_135
The Secret in Their Eyes Poster,Director: Juan José Campanella,"R | 2h 9min | Drama, Mystery, Thriller | 21 May 2010 (USA)",129 min,"Writers: Eduardo Sacheri, Juan José Campanella | 1 more credit »","Stars: Ricardo Darín, Soledad Villamil, Pablo Rago | See full cast & crew »",The Secret in Their Eyes (2009),The Secret in Their Eyes Poster,"Gross: $20,167,424 (USA) (8 January 2016)","http://ia.media-imdb.com/images/M/MV5BMTgwNTI3OTczOV5BMl5BanBnXkFtZTcwMTM3MTUyMw@@._V1_UX182_CR0,0,182,268_AL_.jpg",,"In 1999, retired Argentinian federal justice agent Benjamín Espósito is writing a novel, using an old closed case as the source material. That case is the brutal rape and murder of Liliana Coloto. In addition to seeing the extreme grief of the victim's husband Ricardo Morales, Benjamín, his assistant Pablo Sandoval, and newly hired department chief Irene Menéndez-Hastings were personally affected by the case as Benjamín and Pablo tracked the killer, hence the reason why the unsatisfactory ending to the case has always bothered him. Despite the department already having two other suspects, Benjamín and Pablo ultimately were certain that a man named Isidoro Gómez is the real killer. Although he is aware that historical accuracy is not paramount for the novel, the process of revisiting the case is more an issue of closure for him. He tries to speak to the key players in the case, most specifically Irene, who still works in the justice department and who he has always been attracted to ... Written by Huggo",http://www.imdb.com/title/tt1305806/?pf_rd_m=A2FGELUUNOQJNL&pf_rd_p=2398042102&pf_rd_r=1X7MCR93P67MJYT56GA5&pf_rd_s=center-1&pf_rd_t=15506&pf_rd_i=top&ref_=chttp_tt_136
Blade Runner Poster,Director: Ridley Scott,"R | 1h 57min | Sci-Fi, Thriller | 25 June 1982 (USA)",117 min,"Writers: Hampton Fancher (screenplay), David Webb Peoples (screenplay) (as David Peoples) | 1 more credit »","Stars: Harrison Ford, Rutger Hauer, Sean Young | See full cast & crew »",Blade Runner (1982),Blade Runner Poster,"Gross: $27,000,000 (USA)","http://ia.media-imdb.com/images/M/MV5BMTA4MDQxNTk2NDheQTJeQWpwZ15BbWU3MDE2NjIyODk@._V1_UX182_CR0,0,182,268_AL_.jpg",Genres: Sci-Fi | Thriller,"In the futuristic year of 2019, Los Angeles has become a dark and depressing metropolis, filled with urban decay. Rick Deckard, an ex-cop, is a ""Blade Runner"". Blade runners are people assigned to assassinate ""replicants"". The replicants are androids that look like real human beings. When four replicants commit a bloody mutiny on the Off World colony, Deckard is called out of retirement to track down the androids. As he tracks the replicants, eliminating them one by one, he soon comes across another replicant, Rachel, who evokes human emotion, despite the fact that she's a replicant herself. As Deckard closes in on the leader of the replicant group, his true hatred toward artificial intelligence makes him question his own identity in this future world, including what's human and what's not human. Written by blazesnakes9",http://www.imdb.com/title/tt0083658/?pf_rd_m=A2FGELUUNOQJNL&pf_rd_p=2398042102&pf_rd_r=1X7MCR93P67MJYT56GA5&pf_rd_s=center-1&pf_rd_t=15506&pf_rd_i=top&ref_=chttp_tt_137
"Lock, Stock and Two Smoking Barrels Poster",Director: Guy Ritchie,"R | 1h 47min | Comedy, Crime | 28 August 1998 (UK)",107 min,Writer: Guy Ritchie,"Stars: Jason Flemyng, Dexter Fletcher, Nick Moran | See full cast & crew »","Lock, Stock and Two Smoking Barrels (1998)","Lock, Stock and Two Smoking Barrels Poster","Production Co: Summit Entertainment, Steve Tisch Company, The, SKA Films See more »","http://ia.media-imdb.com/images/M/MV5BMTU4MTM1MjUxMF5BMl5BanBnXkFtZTYwOTEzODY4._V1_UY268_CR5,0,182,268_AL_.jpg",Genres: Comedy | Crime,"Four Jack-the-lads find themselves heavily - seriously heavily - in debt to an East End hard man and his enforcers after a crooked card game. Overhearing their neighbours in the next flat plotting to hold up a group of out-of-their-depth drug growers, our heros decide to stitch up the robbers in turn. In a way the confusion really starts when a pair of antique double-barrelled shotguns go missing in a completely different scam. Written by Anonymous",http://www.imdb.com/title/tt0120735/?pf_rd_m=A2FGELUUNOQJNL&pf_rd_p=2398042102&pf_rd_r=1X7MCR93P67MJYT56GA5&pf_rd_s=center-1&pf_rd_t=15506&pf_rd_i=top&ref_=chttp_tt_138
The General Poster,"Directors: Clyde Bruckman, Buster Keaton","Unrated | 1h 7min | Action, Adventure, Comedy | 24 February 1927 (France)",67 min,"Writers: Buster Keaton, Clyde Bruckman | 2 more credits »","Stars: Buster Keaton, Marion Mack, Glen Cavender | See full cast & crew »",The General (1926),The General Poster,Runtime: 67 min | 80 min (1982) | 83 min (1962) | 75 min (2003 alternate) | 78 min,"http://ia.media-imdb.com/images/M/MV5BODQxMzMyNTY5Nl5BMl5BanBnXkFtZTcwMDMyNTk3OA@@._V1_UX182_CR0,0,182,268_AL_.jpg",Genres: Action | Adventure | Comedy | Drama | War,"Johnnie loves his train (""The General"") and Annabelle Lee. When the Civil War begins he is turned down for service because he's more valuable as an engineer. Annabelle thinks it's because he's a coward. Union spies capture The General with Annabelle on board. Johnnie must rescue both his loves. Written by Ed Stephan <stephan@cc.wwu.edu>",http://www.imdb.com/title/tt0017925/?pf_rd_m=A2FGELUUNOQJNL&pf_rd_p=2398042102&pf_rd_r=1X7MCR93P67MJYT56GA5&pf_rd_s=center-1&pf_rd_t=15506&pf_rd_i=top&ref_=chttp_tt_139
