movieimg/_alt,director,rating/duration/genre/releasedate,runtime,writers,stars,title,movieimg/_title,productioncompany,movieimg,genres,desc,pageUrl
WALL·E Poster,Director: Andrew Stanton,"G | 1h 38min | Animation, Adventure, Family | 27 June 2008 (USA)",98 min,"Writers: Andrew Stanton (original story by), Pete Docter (original story by) | 2 more credits »","Stars: Ben Burtt, Elissa Knight, Jeff Garlin | See full cast & crew »",WALL·E (2008),WALL·E Poster,"Gross: $223,806,889 (USA) (2 January 2009)","http://ia.media-imdb.com/images/M/MV5BMTczOTA3MzY2N15BMl5BanBnXkFtZTcwOTYwNjE2MQ@@._V1_UX182_CR0,0,182,268_AL_.jpg",Genres: Animation | Adventure | Family | Sci-Fi,"In a distant, but not so unrealistic, future where mankind has abandoned earth because it has become covered with trash from products sold by the powerful multi-national Buy N Large corporation, WALL-E, a garbage collecting robot has been left to clean up the mess. Mesmerized with trinkets of Earth's history and show tunes, WALL-E is alone on Earth except for a sprightly pet cockroach. One day, EVE, a sleek (and dangerous) reconnaissance robot, is sent to Earth to find proof that life is once again sustainable. WALL-E falls in love with EVE. WALL-E rescues EVE from a dust storm and shows her a living plant he found amongst the rubble. Consistent with her ""directive"", EVE takes the plant and automatically enters a deactivated state except for a blinking green beacon. WALL-E, doesn't understand what has happened to his new friend, but, true to his love, he protects her from wind, rain, and lightning, even as she is unresponsive. One day a massive ship comes to reclaim EVE, but WALL-E, ... Written by Anonymous",http://www.imdb.com/title/tt0910970/?pf_rd_m=A2FGELUUNOQJNL&pf_rd_p=2398042102&pf_rd_r=1X7MCR93P67MJYT56GA5&pf_rd_s=center-1&pf_rd_t=15506&pf_rd_i=top&ref_=chttp_tt_62
American Beauty Poster,Director: Sam Mendes,"R | 2h 2min | Drama, Romance | 1 October 1999 (USA)",122 min,Writer: Alan Ball,"Stars: Kevin Spacey, Annette Bening, Thora Birch | See full cast & crew »",American Beauty (1999),American Beauty Poster,"Gross: AUD 11,029,726 (Australia) (15 December 2000)","http://ia.media-imdb.com/images/M/MV5BMjM4NTI5NzYyNV5BMl5BanBnXkFtZTgwNTkxNTYxMTE@._V1_UX182_CR0,0,182,268_AL_.jpg",Genres: Drama | Romance,"Lester and Carolyn Burnham are, on the outside, a perfect husband and wife in a perfect house in a perfect neighborhood. But inside, Lester is slipping deeper and deeper into a hopeless depression. He finally snaps when he becomes infatuated with one of his daughter's friends. Meanwhile, his daughter Jane is developing a happy friendship with a shy boy-next-door named Ricky, who lives with an abusive father. Written by Jessie Skinner <eietherbinge@hotmail.com>",http://www.imdb.com/title/tt0169547/?pf_rd_m=A2FGELUUNOQJNL&pf_rd_p=2398042102&pf_rd_r=1X7MCR93P67MJYT56GA5&pf_rd_s=center-1&pf_rd_t=15506&pf_rd_i=top&ref_=chttp_tt_63
Aliens Poster,Director: James Cameron,"R | 2h 17min | Action, Horror, Sci-Fi | 18 July 1986 (USA)",137 min,"Writers: James Cameron (story), David Giler (story) | 4 more credits »","Stars: Sigourney Weaver, Michael Biehn, Carrie Henn | See full cast & crew »",Aliens (1986),Aliens Poster,"Production Co: Twentieth Century Fox Film Corporation, Brandywine Productions, SLM Production Group See more »","http://ia.media-imdb.com/images/M/MV5BMTYzNzU5MzQ4OV5BMl5BanBnXkFtZTcwMDcxNDg3OA@@._V1_UY268_CR9,0,182,268_AL_.jpg",Genres: Action | Horror | Sci-Fi,"Fifty seven years after Ellen Ripley survived her disastrous ordeal, her escape vessel is recovered after drifting across the galaxy as she slept in cryogenic stasis. Back on earth, nobody believed her story about the ""Aliens"" on the planet LV-426. After the ""Company"" orders the colony on LV-426 to investigate, however, all communication with the colony is lost. The Company enlists Ripley to aid a team of tough, rugged space marines on a rescue mission to the now partially terraformed planet to find out if there are aliens or survivors. As the mission unfolds, Ripley will be forced to come to grips with her worst nightmare, but even as she does, she finds that the worst is yet to come. Written by Brian Rawlings",http://www.imdb.com/title/tt0090605/?pf_rd_m=A2FGELUUNOQJNL&pf_rd_p=2398042102&pf_rd_r=1X7MCR93P67MJYT56GA5&pf_rd_s=center-1&pf_rd_t=15506&pf_rd_i=top&ref_=chttp_tt_64
Princess Mononoke Poster,Director: Hayao Miyazaki,"PG-13 | 2h 14min | Animation, Adventure, Fantasy | 12 July 1997 (Japan)",134 min,Writer: Hayao Miyazaki,"Stars: Yôji Matsuda, Yuriko Ishida, Yûko Tanaka | See full cast & crew »",Princess Mononoke (1997),Princess Mononoke Poster,"Production Co: DENTSU Music And Entertainment, Nibariki, Nippon Television Network (NTV) See more »","http://ia.media-imdb.com/images/M/MV5BMjgzNTUwODQzN15BMl5BanBnXkFtZTcwMTc4ODE3OQ@@._V1_UX182_CR0,0,182,268_AL_.jpg",Genres: Animation | Adventure | Fantasy,"While protecting his village from rampaging boar-god/demon, a confident young warrior, Ashitaka, is stricken by a deadly curse. To save his life, he must journey to the forests of the west. Once there, he's embroiled in a fierce campaign that humans were waging on the forest. The ambitious Lady Eboshi and her loyal clan use their guns against the gods of the forest and a brave young woman, Princess Mononoke, who was raised by a wolf-god. Ashitaka sees the good in both sides and tries to stem the flood of blood. This is met be animosity by both sides as they each see him as supporting the enemy. Written by Christopher Taguchi",http://www.imdb.com/title/tt0119698/?pf_rd_m=A2FGELUUNOQJNL&pf_rd_p=2398042102&pf_rd_r=1X7MCR93P67MJYT56GA5&pf_rd_s=center-1&pf_rd_t=15506&pf_rd_i=top&ref_=chttp_tt_65
Oldboy Poster,Director: Chan-wook Park,"R | 2h | Drama, Mystery, Thriller | 21 November 2003 (South Korea)",120 min,"Writers: Garon Tsuchiya (story), Nobuaki Minegishi (comic) | 4 more credits »","Stars: Min-sik Choi, Ji-tae Yu, Hye-jeong Kang | See full cast & crew »",Oldboy (2003),Oldboy Poster,"Gross: $2,181,290 (USA) (20 December 2013)","http://ia.media-imdb.com/images/M/MV5BMTI3NTQyMzU5M15BMl5BanBnXkFtZTcwMTM2MjgyMQ@@._V1_UX182_CR0,0,182,268_AL_.jpg",Genres: Drama | Mystery | Thriller,"An average man is kidnapped and imprisoned in a shabby cell for 15 years without explanation. He then is released, equipped with money, a cellphone and expensive clothes. As he strives to explain his imprisonment and get his revenge, Oh Dae-Su soon finds out that his kidnapper has a greater plan for him and is set onto a path of pain and suffering in an attempt to uncover the motive of his mysterious tormentor. Written by Jacksrevenge",http://www.imdb.com/title/tt0364569/?pf_rd_m=A2FGELUUNOQJNL&pf_rd_p=2398042102&pf_rd_r=1X7MCR93P67MJYT56GA5&pf_rd_s=center-1&pf_rd_t=15506&pf_rd_i=top&ref_=chttp_tt_66
Citizen Kane Poster,Director: Orson Welles,"Approved | 1h 59min | Drama, Mystery | 5 September 1941 (USA)",119 min,"Writers: Herman J. Mankiewicz (original screen play), Orson Welles (original screen play)","Stars: Orson Welles, Joseph Cotten, Dorothy Comingore | See full cast & crew »",Citizen Kane (1941),Citizen Kane Poster,Runtime: 119 min,"http://ia.media-imdb.com/images/M/MV5BMTQ2Mjc1MDQwMl5BMl5BanBnXkFtZTcwNzUyOTUyMg@@._V1_UX182_CR0,0,182,268_AL_.jpg",Genres: Drama | Mystery,"A group of reporters are trying to decipher the last word ever spoken by Charles Foster Kane, the millionaire newspaper tycoon: ""Rosebud."" The film begins with a news reel detailing Kane's life for the masses, and then from there, we are shown flashbacks from Kane's life. As the reporters investigate further, the viewers see a display of a fascinating man's rise to fame, and how he eventually fell off the top of the world. Written by Zack H.",http://www.imdb.com/title/tt0033467/?pf_rd_m=A2FGELUUNOQJNL&pf_rd_p=2398042102&pf_rd_r=1X7MCR93P67MJYT56GA5&pf_rd_s=center-1&pf_rd_t=15506&pf_rd_i=top&ref_=chttp_tt_67
North by Northwest Poster,Director: Alfred Hitchcock,"Approved | 2h 16min | Adventure, Crime, Mystery | 26 September 1959 (Japan)",136 min,Writer: Ernest Lehman,"Stars: Cary Grant, Eva Marie Saint, James Mason | See full cast & crew »",North by Northwest (1959),North by Northwest Poster,Runtime: 136 min,"http://ia.media-imdb.com/images/M/MV5BMjQwMTQ0MzgwNl5BMl5BanBnXkFtZTgwNjc4ODE4MzE@._V1_UX182_CR0,0,182,268_AL_.jpg",Genres: Adventure | Crime | Mystery | Thriller,"Madison Avenue advertising man Roger Thornhill finds himself thrust into the world of spies when he is mistaken for a man by the name of George Kaplan. Foreign spy Philip Vandamm and his henchman Leonard try to eliminate him but when Thornhill tries to make sense of the case, he is framed for murder. Now on the run from the police, he manages to board the 20th Century Limited bound for Chicago where he meets a beautiful blond, Eve Kendall, who helps him to evade the authorities. His world is turned upside down yet again when he learns that Eve isn't the innocent bystander he thought she was. Not all is as it seems however, leading to a dramatic rescue and escape at the top of Mt. Rushmore. Written by garykmcd",http://www.imdb.com/title/tt0053125/?pf_rd_m=A2FGELUUNOQJNL&pf_rd_p=2398042102&pf_rd_r=1X7MCR93P67MJYT56GA5&pf_rd_s=center-1&pf_rd_t=15506&pf_rd_i=top&ref_=chttp_tt_68
Once Upon a Time in America Poster,Director: Sergio Leone,"R | 3h 49min | Crime, Drama | 1 June 1984 (USA)",229 min,"Writers: Harry Grey (novel), Leonardo Benvenuti (screenplay) | 6 more credits »","Stars: Robert De Niro, James Woods, Elizabeth McGovern | See full cast & crew »",Once Upon a Time in America (1984),Once Upon a Time in America Poster,"Production Co: Ladd Company, The, Embassy International Pictures, PSO International See more »","http://ia.media-imdb.com/images/M/MV5BNDMwMDcyODkzOV5BMl5BanBnXkFtZTcwNTQ1Njg3OA@@._V1_UY268_CR3,0,182,268_AL_.jpg",Genres: Crime | Drama,"Epic tale of a group of Jewish gangsters in New York, from childhood, through their glory years during prohibition, and their meeting again 35 years later. Written by Andrew Welsh <andreww@bnr.ca>",http://www.imdb.com/title/tt0087843/?pf_rd_m=A2FGELUUNOQJNL&pf_rd_p=2398042102&pf_rd_r=1X7MCR93P67MJYT56GA5&pf_rd_s=center-1&pf_rd_t=15506&pf_rd_i=top&ref_=chttp_tt_69
Vertigo Poster,Director: Alfred Hitchcock,"PG | 2h 8min | Mystery, Romance, Thriller | 1958 (UK)",128 min,"Writers: Alec Coppel (screenplay), Samuel A. Taylor (screenplay) (as Samuel Taylor) | 2 more credits »","Stars: James Stewart, Kim Novak, Barbara Bel Geddes | See full cast & crew »",Vertigo (1958),Vertigo Poster,Production Co: Alfred J. Hitchcock Productions See more »,"http://ia.media-imdb.com/images/M/MV5BNzY0NzQyNzQzOF5BMl5BanBnXkFtZTcwMTgwNTk4OQ@@._V1_UX182_CR0,0,182,268_AL_.jpg",Genres: Mystery | Romance | Thriller,"John ""Scottie"" Ferguson is a retired San Francisco police detective who suffers from acrophobia and Madeleine is the lady who leads him to high places. A wealthy shipbuilder who is an acquaintance from college days approaches Scottie and asks him to follow his beautiful wife, Madeleine. He fears she is going insane, maybe even contemplating suicide, because she believes she is possessed by a dead ancestor. Scottie is skeptical, but agrees after he sees the beautiful Madeleine. Written by filmfactsman",http://www.imdb.com/title/tt0052357/?pf_rd_m=A2FGELUUNOQJNL&pf_rd_p=2398042102&pf_rd_r=1X7MCR93P67MJYT56GA5&pf_rd_s=center-1&pf_rd_t=15506&pf_rd_i=top&ref_=chttp_tt_70
Das Boot Poster,Director: Wolfgang Petersen,"R | 2h 29min | Adventure, Drama, Thriller | 10 February 1982 (USA)",149 min,"Writers: Wolfgang Petersen (screenplay), Lothar G. Buchheim (novel)","Stars: Jürgen Prochnow, Herbert Grönemeyer, Klaus Wennemann | See full cast & crew »",Das Boot (1981),Das Boot Poster,"Gross: $11,433,134 (USA) (25 April 1997)","http://ia.media-imdb.com/images/M/MV5BMjE5Mzk5OTQ0Nl5BMl5BanBnXkFtZTYwNzUwMTQ5._V1_UX182_CR0,0,182,268_AL_.jpg",Genres: Adventure | Drama | Thriller | War,"It is 1942 and the German submarine fleet is heavily engaged in the so-called ""Battle of the Atlantic"" to harass and destroy British shipping. With better escorts of the Destroyer Class, however, German U-Boats have begun to take heavy losses. ""Das Boot"" is the story of one such U-Boat crew, with the film examining how these submariners maintained their professionalism as soldiers and attempted to accomplish impossible missions, all the while attempting to understand and obey the ideology of the government under which they served. Written by Anthony Hughes <husnock31@hotmail.com>",http://www.imdb.com/title/tt0082096/?pf_rd_m=A2FGELUUNOQJNL&pf_rd_p=2398042102&pf_rd_r=1X7MCR93P67MJYT56GA5&pf_rd_s=center-1&pf_rd_t=15506&pf_rd_i=top&ref_=chttp_tt_71
Star Wars: Episode VI - Return of the Jedi Poster,Director: Richard Marquand,"PG | 2h 11min | Action, Adventure, Fantasy | 25 May 1983 (USA)",131 min,"Writers: Lawrence Kasdan (screenplay), George Lucas (screenplay) | 1 more credit »","Stars: Mark Hamill, Harrison Ford, Carrie Fisher | See full cast & crew »",Star Wars: Episode VI - Return of the Jedi (1983),Star Wars: Episode VI - Return of the Jedi Poster,"Gross: $309,125,409 (USA) (6 June 1997)","http://ia.media-imdb.com/images/M/MV5BMTQ0MzI1NjYwOF5BMl5BanBnXkFtZTgwODU3NDU2MTE@._V1._CR93,97,1209,1861_UX182_CR0,0,182,268_AL_.jpg",Genres: Action | Adventure | Fantasy | Sci-Fi,"Darth Vader and the Empire are building a new, indestructible Death Star. Meanwhile, Han Solo has been imprisoned, and Luke Skywalker has sent R2-D2 and C-3PO to try and free him. Princess Leia - disguised as a bounty hunter - and Chewbacca go along as well. The final battle takes place on the moon of Endor, with its natural inhabitants, the Ewoks, lending a hand to the Rebels. Will Darth Vader and the Dark Side overcome the Rebels and take over the universe? Written by Colin Tinto <cst@imdb.com>",http://www.imdb.com/title/tt0086190/?pf_rd_m=A2FGELUUNOQJNL&pf_rd_p=2398042102&pf_rd_r=1X7MCR93P67MJYT56GA5&pf_rd_s=center-1&pf_rd_t=15506&pf_rd_i=top&ref_=chttp_tt_72
M Poster,Director: Fritz Lang,"Not Rated | 1h 39min | Crime, Drama, Mystery | 31 August 1931 (Sweden)",117 min,"Writers: Thea von Harbou (script), Fritz Lang (script)","Stars: Peter Lorre, Ellen Widmann, Inge Landgut | See full cast & crew »",M (1931),M Poster,Show detailed company contact information on IMDbPro »,"http://ia.media-imdb.com/images/M/MV5BMTQyNjA5NzU5MV5BMl5BanBnXkFtZTgwMDk1MTA5MTE@._V1_UY268_CR3,0,182,268_AL_.jpg",,"In Germany, Hans Beckert is an unknown killer of girls. He whistles Edvard Grieg's 'In The Hall of the Mountain King', from the 'Peer Gynt' Suite I Op. 46 while attracting the little girls for death. The police force pressed by the Minister give its best effort trying unsuccessfully to arrest the serial killer. The organized crime has great losses due to the intense search and siege of the police and decides to chase the murderer, with the support of the beggars association. They catch Hans and briefly judge him. Written by Claudio Carvalho, Rio de Janeiro, Brazil",http://www.imdb.com/title/tt0022100/?pf_rd_m=A2FGELUUNOQJNL&pf_rd_p=2398042102&pf_rd_r=1X7MCR93P67MJYT56GA5&pf_rd_s=center-1&pf_rd_t=15506&pf_rd_i=top&ref_=chttp_tt_73
Witness for the Prosecution Poster,Director: Billy Wilder,"Approved | 1h 56min | Drama, Mystery | 6 February 1958 (USA)",116 min,"Writers: Agatha Christie (in Agatha Christie's international stage success), Billy Wilder (screen play) | 2 more credits »","Stars: Tyrone Power, Marlene Dietrich, Charles Laughton | See full cast & crew »",Witness for the Prosecution (1957),Witness for the Prosecution Poster,Runtime: 116 min,"http://ia.media-imdb.com/images/M/MV5BMTc0MjgyNTUyNF5BMl5BanBnXkFtZTcwNDQzMDg0Nw@@._V1_UX182_CR0,0,182,268_AL_.jpg",Genres: Drama | Mystery,"It's Britain, 1953. Upon his return to work following a heart attack, irrepressible barrister Sir Wilfrid Robarts, known as a barrister for the hopeless, takes on a murder case, much to the exasperation of his medical team, led by his overly regulated private nurse, Miss Plimsoll, who tries her hardest to ensure that he not return to his hard living ways - including excessive cigar smoking and drinking - while he takes his medication and gets his much needed rest. That case is defending American war veteran Leonard Vole, a poor, out of work, struggling inventor who is accused of murdering his fifty-six year old lonely and wealthy widowed acquaintance, Emily French. The initial evidence is circumstantial but points to Leonard as the murderer. Despite being happily married to East German former beer hall performer Christine Vole, he fostered that friendship with Mrs. French in the hopes that she would finance one of his many inventions to the tune of a few hundred pounds. It thus does ... Written by Huggo",http://www.imdb.com/title/tt0051201/?pf_rd_m=A2FGELUUNOQJNL&pf_rd_p=2398042102&pf_rd_r=1X7MCR93P67MJYT56GA5&pf_rd_s=center-1&pf_rd_t=15506&pf_rd_i=top&ref_=chttp_tt_74
Amélie Poster,Director: Jean-Pierre Jeunet,"R | 2h 2min | Comedy, Romance | 8 February 2002 (USA)",122 min,"Writers: Guillaume Laurant (scenario), Jean-Pierre Jeunet (scenario) | 1 more credit »","Stars: Audrey Tautou, Mathieu Kassovitz, Rufus | See full cast & crew »",Amélie (2001),Amélie Poster,"Gross: $33,201,661 (USA) (28 June 2002)","http://ia.media-imdb.com/images/M/MV5BMTYzNjkxMTczOF5BMl5BanBnXkFtZTgwODg5NDc2MjE@._V1_UX182_CR0,0,182,268_AL_.jpg",Genres: Comedy | Romance,"Amélie is a story about a girl named Amélie whose childhood was suppressed by her Father's mistaken concerns of a heart defect. With these concerns Amélie gets hardly any real life contact with other people. This leads Amélie to resort to her own fantastical world and dreams of love and beauty. She later on becomes a young woman and moves to the central part of Paris as a waitress. After finding a lost treasure belonging to the former occupant of her apartment, she decides to return it to him. After seeing his reaction and his new found perspective - she decides to devote her life to the people around her. Such as, her father who is obsessed with his garden-gnome, a failed writer, a hypochondriac, a man who stalks his ex girlfriends, the ""ghost"", a suppressed young soul, the love of her life and a man whose bones are as brittle as glass. But after consuming herself with these escapades - she finds out that she is disregarding her own life and damaging her quest for love. Amélie then ... Written by spragg_s",http://www.imdb.com/title/tt0211915/?pf_rd_m=A2FGELUUNOQJNL&pf_rd_p=2398042102&pf_rd_r=1X7MCR93P67MJYT56GA5&pf_rd_s=center-1&pf_rd_t=15506&pf_rd_i=top&ref_=chttp_tt_75
Reservoir Dogs Poster,Director: Quentin Tarantino,"R | 1h 39min | Crime, Thriller | 2 September 1992 (France)",99 min,"Writers: Quentin Tarantino, Roger Avary (background radio dialog) | 1 more credit »","Stars: Harvey Keitel, Tim Roth, Michael Madsen | See full cast & crew »",Reservoir Dogs (1992),Reservoir Dogs Poster,"Production Co: Live Entertainment, Dog Eat Dog Productions Inc. See more »","http://ia.media-imdb.com/images/M/MV5BMTQxMTAwMDQ3Nl5BMl5BanBnXkFtZTcwODMwNTgzMQ@@._V1_UY268_CR3,0,182,268_AL_.jpg",Genres: Crime | Thriller,"Six criminals, who are strangers to each other, are hired by a crime boss, Joe Cabot, to carry out a diamond robbery. Right at the outset, they are given false names with the intention that they won't get too close and will concentrate on the job instead. They are completely sure that the robbery is going to be a success. But, when the police show up right at the time and the site of the robbery, panic spreads amongst the group members, and two of them are killed in the subsequent shootout, along with a few policemen and civilians. When the remaining people assemble at the premeditated rendezvous point (a warehouse), they begin to suspect that one of them is an undercover cop. Written by Soumitra",http://www.imdb.com/title/tt0105236/?pf_rd_m=A2FGELUUNOQJNL&pf_rd_p=2398042102&pf_rd_r=1X7MCR93P67MJYT56GA5&pf_rd_s=center-1&pf_rd_t=15506&pf_rd_i=top&ref_=chttp_tt_76
Braveheart Poster,Director: Mel Gibson,"R | 2h 58min | Biography, Drama, History | 24 May 1995 (USA)",178 min,Writer: Randall Wallace,"Stars: Mel Gibson, Sophie Marceau, Patrick McGoohan | See full cast & crew »",Braveheart (1995),Braveheart Poster,Show detailed company contact information on IMDbPro »,"http://ia.media-imdb.com/images/M/MV5BNjA4ODYxMDU3Nl5BMl5BanBnXkFtZTcwMzkzMTk3OA@@._V1_UX182_CR0,0,182,268_AL_.jpg",Genres: Biography | Drama | History | War,"William Wallace is a Scottish rebel who leads an uprising against the cruel English ruler Edward the Longshanks, who wishes to inherit the crown of Scotland for himself. When he was a young boy, William Wallace's father and brother, along with many others, lost their lives trying to free Scotland. Once he loses another of his loved ones, William Wallace begins his long quest to make Scotland free once and for all, along with the assistance of Robert the Bruce. Written by Anonymous",http://www.imdb.com/title/tt0112573/?pf_rd_m=A2FGELUUNOQJNL&pf_rd_p=2398042102&pf_rd_r=1X7MCR93P67MJYT56GA5&pf_rd_s=center-1&pf_rd_t=15506&pf_rd_i=top&ref_=chttp_tt_77
Requiem for a Dream Poster,Director: Darren Aronofsky,R | 1h 42min | Drama | 15 December 2000 (USA),102 min,"Writers: Hubert Selby Jr. (based on the book by), Hubert Selby Jr. (screenplay) | 1 more credit »","Stars: Ellen Burstyn, Jared Leto, Jennifer Connelly | See full cast & crew »",Requiem for a Dream (2000),Requiem for a Dream Poster,"Gross: ESP 15,606,075 (Spain) (29 June 2001)","http://ia.media-imdb.com/images/M/MV5BMTkzODMzODYwOF5BMl5BanBnXkFtZTcwODM2NjA2NQ@@._V1_UY268_CR2,0,182,268_AL_.jpg",Genres: Drama,"Drugs. They consume mind, body and soul. Once you're hooked, you're hooked. Four lives. Four addicts. Four failures. Despite their aspirations of greatness, they succumb to their addictions. Watching the addicts spiral out of control, we bear witness to the dirtiest, ugliest portions of the underworld addicts reside in. It is shocking and eye-opening but demands to be seen by both addicts and non-addicts alike. Written by Jeff Mellinger <jmell@uclink4.berkeley.edu>",http://www.imdb.com/title/tt0180093/?pf_rd_m=A2FGELUUNOQJNL&pf_rd_p=2398042102&pf_rd_r=1X7MCR93P67MJYT56GA5&pf_rd_s=center-1&pf_rd_t=15506&pf_rd_i=top&ref_=chttp_tt_78
A Clockwork Orange Poster,Director: Stanley Kubrick,"X | 2h 16min | Crime, Drama, Sci-Fi | 2 February 1972 (USA)",136 min,"Writers: Stanley Kubrick (screenplay), Anthony Burgess (novel)","Stars: Malcolm McDowell, Patrick Magee, Michael Bates | See full cast & crew »",A Clockwork Orange (1971),A Clockwork Orange Poster,"Production Co: Warner Bros., Hawk Films See more »","http://ia.media-imdb.com/images/M/MV5BMTY3MjM1Mzc4N15BMl5BanBnXkFtZTgwODM0NzAxMDE@._V1_UX182_CR0,0,182,268_AL_.jpg",Genres: Crime | Drama | Sci-Fi,"Protagonist Alex DeLarge is an ""ultraviolent"" youth in futuristic Britain. As with all luck, his eventually runs out and he's arrested and convicted of murder and rape. While in prison, Alex learns of an experimental program in which convicts are programmed to detest violence. If he goes through the program, his sentence will be reduced and he will be back on the streets sooner than expected. But Alex's ordeals are far from over once he hits the mean streets of Britain that he had a hand in creating. Written by Nikki Carlyle",http://www.imdb.com/title/tt0066921/?pf_rd_m=A2FGELUUNOQJNL&pf_rd_p=2398042102&pf_rd_r=1X7MCR93P67MJYT56GA5&pf_rd_s=center-1&pf_rd_t=15506&pf_rd_i=top&ref_=chttp_tt_79
Taxi Driver Poster,Director: Martin Scorsese,"R | 1h 53min | Crime, Drama | 8 February 1976 (USA)",113 min,Writer: Paul Schrader,"Stars: Robert De Niro, Jodie Foster, Cybill Shepherd | See full cast & crew »",Taxi Driver (1976),Taxi Driver Poster,"Production Co: Columbia Pictures Corporation, Bill/Phillips, Italo/Judeo Productions See more »","http://ia.media-imdb.com/images/M/MV5BMTQ1Nzg3MDQwN15BMl5BanBnXkFtZTcwNDE2NDU2MQ@@._V1_UY268_CR7,0,182,268_AL_.jpg",Genres: Crime | Drama,"Travis Bickle is an ex-Marine and Vietnam War veteran living in New York City. As he suffers from insomnia, he spends his time working as a taxi driver at night, watching porn movies at seedy cinemas during the day, or thinking about how the world, New York in particular, has deteriorated into a cesspool. He's a loner who has strong opinions about what is right and wrong with mankind. For him, the one bright spot in New York humanity is Betsy, a worker on the presidential nomination campaign of Senator Charles Palantine. He becomes obsessed with her. After an incident with her, he believes he has to do whatever he needs to make the world a better place in his opinion. One of his priorities is to be the savior for Iris, a twelve-year-old runaway and prostitute who he believes wants out of the profession and under the thumb of her pimp and lover Matthew. Written by Huggo",http://www.imdb.com/title/tt0075314/?pf_rd_m=A2FGELUUNOQJNL&pf_rd_p=2398042102&pf_rd_r=1X7MCR93P67MJYT56GA5&pf_rd_s=center-1&pf_rd_t=15506&pf_rd_i=top&ref_=chttp_tt_80
